{
  "numericalContractId": "nc-gguf-q4-cpu-v1",
  "tokenizerIdentity": "cccccccccccccccccccccccccccccccccccccccccccccccccccccccccccccccc",
  "promptByteIdentity": "dddddddddddddddddddddddddddddddddddddddddddddddddddddddddddddddd",
  "stopTokenIdentity": "stop-chatml-v1",
  "contextCap": 4096,
  "deterministicTestMode": true,
  "logitsTolerance": 0.001,
  "embeddingTolerance": 0.0001,
  "generatedTokenPolicy": "exactUnderGreedy"
}
